{
  "$schema": "https://json-schema.org/draft/2020-12/schema",
  "$id": "https://tebin-style/schema/theme.schema.json",
  "type": "object",
  "additionalProperties": true,
  "required": ["id", "name", "version", "license"],
  "properties": {
    "id": { "type": "string", "pattern": "^[a-z0-9]+(-[a-z0-9]+)*$" },
    "name": { "type": "string", "minLength": 1 },
    "description": { "type": "string" },
    "version": { "type": "string", "pattern": "^\\d+\\.\\d+\\.\\d+$" },
    "media": { "type": "array", "minItems": 1, "uniqueItems": true, "items": { "enum": ["web", "document", "print"] } },
    "industry": { "type": "array", "items": { "type": "string" } },
    "mood": { "type": "array", "items": { "type": "string" } },
    "source": {
      "type": "object",
      "properties": {
        "url": { "type": "string" },
        "extractedBy": { "type": "string", "enum": ["manual", "auto"] }
      }
    },
    "license": {
      "type": "object",
      "required": ["tokens", "assets"],
      "properties": {
        "tokens": { "type": "string" },
        "assets": { "type": "string" }
      }
    },
    "author": { "type": "string" },
    "createdAt": { "type": "string" },
    "updatedAt": { "type": "string" },
    "surfaces": {
      "type": "object",
      "additionalProperties": false,
      "required": ["light"],
      "properties": {
        "light": { "type": "string", "pattern": "^#[0-9a-fA-F]{6}$" },
        "dark":  { "type": "string", "pattern": "^#[0-9a-fA-F]{6}$" }
      }
    },
    "contrastPairs": {
      "type": "object",
      "propertyNames": { "pattern": "^[a-z0-9]+(-[a-z0-9]+)*$" },
      "additionalProperties": {
        "type": "object", "additionalProperties": false,
        "required": ["foreground", "background"],
        "properties": {
          "foreground": { "type": "string", "minLength": 1 },
          "background": { "type": "string", "minLength": 1 },
          "min": {
            "description": "The ratio the pair must reach. 4.5 (the default) for text; 3 for a non-text edge or icon (WCAG 1.4.11); 7 for AAA text.",
            "enum": [3, 4.5, 7]
          }
        }
      }
    },
    "omitted": {
      "type": "array",
      "items": {
        "type": "object",
        "additionalProperties": false,
        "required": ["section", "reason"],
        "properties": {
          "section": { "type": "string", "minLength": 1 },
          "reason": { "type": "string", "minLength": 1 }
        }
      }
    },
    "assets": {
      "type": "array",
      "items": {
        "type": "object",
        "required": ["id", "type", "format", "path"],
        "properties": {
          "id": { "type": "string", "pattern": "^[a-z0-9]+([-_][a-z0-9]+)*$" },
          "type": { "type": "string", "enum": ["logo", "favicon", "font", "icon", "pattern", "image"] },
          "variant": { "type": "string" },
          "format": { "type": "string" },
          "path": { "type": "string" },
          "license": { "type": "string" }
        }
      }
    }
  }
}
