{
  "$schema": "../../schema/theme.schema.json",
  "id": "tebin",
  "name": "TEBIN",
  "description": "Industrial design-and-engineering brand: condensed type, signal red on charcoal.",
  "version": "1.8.0",
  "media": ["web"],
  "contrastPairs": {
    "form-label-on-paper": { "foreground": "{color.ink}", "background": "{color.paper}" },
    "form-error-on-paper": { "foreground": "{color.brick}", "background": "{color.paper}" },
    "commit-label-on-brand": { "foreground": "#FFFFFF", "background": "{color.brand}" }
  },
  "industry": [
    "engineering",
    "industrial",
    "b2b"
  ],
  "mood": [
    "bold",
    "technical",
    "high-contrast"
  ],
  "source": {
    "url": "https://tebin.pro",
    "extractedBy": "manual"
  },
  "license": {
    "tokens": "MIT",
    "assets": "© TEBIN — all rights reserved"
  },
  "author": "TEBIN",
  "createdAt": "2026-06-22",
  "updatedAt": "2026-10-17",
  "surfaces": {
    "light": "#EFEEE9",
    "dark": "#242830"
  },
  "omitted": [],
  "assets": [
    {
      "id": "logo-full",
      "type": "logo",
      "variant": "full",
      "format": "svg",
      "path": "assets/logo/logo-full.svg"
    },
    {
      "id": "logo-full-white",
      "type": "logo",
      "variant": "white",
      "format": "svg",
      "path": "assets/logo/logo-full-white.svg"
    },
    {
      "id": "favicon-svg",
      "type": "favicon",
      "format": "svg",
      "path": "assets/favicon/favicon.svg"
    },
    {
      "id": "favicon-png",
      "type": "favicon",
      "format": "png",
      "path": "assets/favicon/favicon.png"
    },
    {
      "id": "favicon-ico",
      "type": "favicon",
      "format": "ico",
      "path": "assets/favicon/favicon.ico"
    },
    {
      "id": "corner-outline",
      "type": "pattern",
      "format": "svg",
      "path": "assets/misc/corner_outline.svg"
    },
    {
      "id": "corner-mark",
      "type": "pattern",
      "variant": "solid",
      "format": "svg",
      "path": "assets/misc/corner-mark.svg"
    },
    {
      "id": "corner-mark-white",
      "type": "pattern",
      "variant": "white",
      "format": "svg",
      "path": "assets/misc/corner-mark-white.svg"
    },
    {
      "id": "fxptebin",
      "type": "image",
      "format": "png",
      "path": "assets/misc/fxptebin.png"
    }
  ]
}
