{
  "$schema": "../../schema/theme.schema.json",
  "id": "slate",
  "name": "Slate",
  "description": "Neutral, modern SaaS palette: cool grays with a blue accent, Inter + JetBrains Mono.",
  "version": "1.2.0",
  "media": ["web"],
  "industry": [
    "saas",
    "web",
    "general"
  ],
  "mood": [
    "minimal",
    "calm",
    "modern"
  ],
  "source": {
    "extractedBy": "manual"
  },
  "license": {
    "tokens": "MIT",
    "assets": "MIT"
  },
  "author": "tebin-style",
  "createdAt": "2026-06-23",
  "updatedAt": "2026-08-27",
  "surfaces": {
    "light": "#FFFFFF"
  },
  "omitted": [
    {
      "section": "assets",
      "reason": "Token-only theme; no brand assets exist."
    },
    {
      "section": "components",
      "reason": "No canonical button exists across the TEBIN apps; codifying one would invent a house style rather than record one."
    }
  ],
  "assets": []
}
